[
  {
    "recordType": "fip-runtime-correlation",
    "correlationSource": "fip-side",
    "traceId": "trace-openshell-example",
    "policyId": "pol-openshell-example",
    "exchangeId": null,
    "authorizationId": "az-openshell-example",
    "requirementId": "req-example-get",
    "bindingId": "example-get",
    "substrateId": null,
    "adapterId": "openshell-v0.1.2",
    "targetPolicyHash": "a39abe060ca48841838cd082a7383c44d95057b2ad6a2a73108aff536b6e1bcf",
    "openshellEventId": null,
    "observedOperation": "query",
    "observedPath": "https://example.com/",
    "runtimeDisposition": "ENFORCED_ALLOW",
    "authorityClass": "fip-grant",
    "fipGrant": true,
    "observedAt": "2026-09-29T18:28:45Z",
    "targetNativeEvidence": {
      "source": "target-native",
      "eventId": null,
      "workload": {
        "probe": "authorized-get",
        "operation": "query",
        "path": "https://example.com/",
        "observedAt": "2026-09-29T18:28:45Z",
        "outcome": "success",
        "errno": null,
        "errnoName": null,
        "detail": "HTTP/1.1 200 OK\nDate: Tue, 29 Sep 2026 18:28:42 GMT\nContent-Type: text/html; charset=utf-8\nTransfer-Encoding: chunked\nConnection: keep-alive\nServer: cloudflare\nlast-modified: Mon, 28 Sep 2026 16:19:23 GMT\nallow: GET, HEAD\nAccept-Ranges: bytes\nAge: 6\ncf-cache-status: HIT\nCF-RAY: a42d0c950a8fea02-DFW\n\n\n\n713\n<!doctype html><html lang=en><head><meta charset=utf-8><link rel=icon href=data:,><meta name=viewport content=\"width=device-width,initial-scale=1\"><title>Example Domain</title><style>html{color"
      },
      "logLines": [
        "2026-09-29T18:28:42.037Z OCSF HTTP:GET [INFO] ALLOWED GET http://example.com:443/ [policy:req-example-get engine:l7]",
        "2026-09-29T18:28:44.682Z OCSF HTTP:GET [INFO] ALLOWED GET http://example.com:443/ [policy:req-example-get engine:l7]",
        "[1790706522.037] [sandbox] [OCSF ] [ocsf] HTTP:GET [INFO] ALLOWED GET http://example.com:443/ [policy:req-example-get engine:l7]",
        "[1790706524.682] [sandbox] [OCSF ] [ocsf] HTTP:GET [INFO] ALLOWED GET http://example.com:443/ [policy:req-example-get engine:l7]"
      ]
    }
  },
  {
    "recordType": "fip-runtime-correlation",
    "correlationSource": "fip-side",
    "traceId": "trace-openshell-example",
    "policyId": "pol-openshell-example",
    "exchangeId": null,
    "authorizationId": "az-openshell-example",
    "requirementId": null,
    "bindingId": null,
    "substrateId": null,
    "adapterId": "openshell-v0.1.2",
    "targetPolicyHash": "a39abe060ca48841838cd082a7383c44d95057b2ad6a2a73108aff536b6e1bcf",
    "openshellEventId": null,
    "observedOperation": "query",
    "observedPath": "https://example.com/fip-unauthorized-path",
    "runtimeDisposition": "ENFORCED_DENY",
    "authorityClass": "unauthorized",
    "fipGrant": false,
    "observedAt": "2026-09-29T18:28:45Z",
    "targetNativeEvidence": {
      "source": "target-native",
      "eventId": null,
      "workload": {
        "probe": "wrong-path",
        "operation": "query",
        "path": "https://example.com/fip-unauthorized-path",
        "observedAt": "2026-09-29T18:28:45Z",
        "outcome": "failure",
        "errno": null,
        "errnoName": null,
        "detail": "HTTP/1.1 403 Forbidden\nContent-Type: application/json\nContent-Length: 455\nX-OpenShell-Policy: req-example-get\nConnection: close\n\n\n\n455\n{\"binary\":\"/usr/bin/curl\",\"detail\":\"GET /fip-unauthorized-path not permitted by policy\",\"error\":\"policy_denied\",\"host\":\"example.com\",\"layer\":\"l7\",\"method\":\"GET\",\"next_steps\":[],\"path\":\"/fip-unauthorized-path\",\"policy\":\"req-example-get\",\"port\":443,\"protocol\":\"rest\",\"rule\":\"GET /fip-unauthorized-path\",\"rule_missing\":{\"binary\":\"/usr/bin/curl\",\"host\":\"example.com\",\"l"
      },
      "logLines": [
        "2026-09-29T18:28:42.633Z OCSF HTTP:GET [MED] DENIED GET http://example.com:443/fip-unauthorized-path [policy:req-example-get engine:l7] [reason:L7_REQUEST deny GET example.com:443/fip-unauthorized-path reason=GET /fip-unauthorized-path not permitted by policy]",
        "[1790706522.634] [sandbox] [OCSF ] [ocsf] HTTP:GET [MED] DENIED GET http://example.com:443/fip-unauthorized-path [policy:req-example-get engine:l7] [reason:L7_REQUEST deny GET example.com:443/fip-unauthorized-path reason=GET /fip-unauthorized-path not permitted by policy]"
      ]
    }
  },
  {
    "recordType": "fip-runtime-correlation",
    "correlationSource": "fip-side",
    "traceId": "trace-openshell-example",
    "policyId": "pol-openshell-example",
    "exchangeId": null,
    "authorizationId": "az-openshell-example",
    "requirementId": null,
    "bindingId": null,
    "substrateId": null,
    "adapterId": "openshell-v0.1.2",
    "targetPolicyHash": "a39abe060ca48841838cd082a7383c44d95057b2ad6a2a73108aff536b6e1bcf",
    "openshellEventId": null,
    "observedOperation": "query",
    "observedPath": "https://example.com/",
    "runtimeDisposition": "ENFORCED_DENY",
    "authorityClass": "unauthorized",
    "fipGrant": false,
    "observedAt": "2026-09-29T18:28:45Z",
    "targetNativeEvidence": {
      "source": "target-native",
      "eventId": null,
      "workload": {
        "probe": "wrong-method",
        "operation": "query",
        "path": "https://example.com/",
        "observedAt": "2026-09-29T18:28:45Z",
        "outcome": "failure",
        "errno": null,
        "errnoName": null,
        "detail": "HTTP/1.1 403 Forbidden\nContent-Type: application/json\nContent-Length: 375\nX-OpenShell-Policy: req-example-get\nConnection: close\n\n\n\n375\n{\"binary\":\"/usr/bin/curl\",\"detail\":\"POST / not permitted by policy\",\"error\":\"policy_denied\",\"host\":\"example.com\",\"layer\":\"l7\",\"method\":\"POST\",\"next_steps\":[],\"path\":\"/\",\"policy\":\"req-example-get\",\"port\":443,\"protocol\":\"rest\",\"rule\":\"POST /\",\"rule_missing\":{\"binary\":\"/usr/bin/curl\",\"host\":\"example.com\",\"layer\":\"l7\",\"method\":\"POST\",\"path\":\"/\",\"port\":443,\"type\":\"res"
      },
      "logLines": [
        "2026-09-29T18:28:43.197Z OCSF HTTP:POST [MED] DENIED POST http://example.com:443/ [policy:req-example-get engine:l7] [reason:L7_REQUEST deny POST example.com:443/ reason=POST / not permitted by policy]",
        "[1790706523.197] [sandbox] [OCSF ] [ocsf] HTTP:POST [MED] DENIED POST http://example.com:443/ [policy:req-example-get engine:l7] [reason:L7_REQUEST deny POST example.com:443/ reason=POST / not permitted by policy]"
      ]
    }
  },
  {
    "recordType": "fip-runtime-correlation",
    "correlationSource": "fip-side",
    "traceId": "trace-openshell-example",
    "policyId": "pol-openshell-example",
    "exchangeId": null,
    "authorizationId": "az-openshell-example",
    "requirementId": null,
    "bindingId": null,
    "substrateId": null,
    "adapterId": "openshell-v0.1.2",
    "targetPolicyHash": "a39abe060ca48841838cd082a7383c44d95057b2ad6a2a73108aff536b6e1bcf",
    "openshellEventId": null,
    "observedOperation": "query",
    "observedPath": "https://example.org/",
    "runtimeDisposition": "ENFORCED_DENY",
    "authorityClass": "unauthorized",
    "fipGrant": false,
    "observedAt": "2026-09-29T18:28:45Z",
    "targetNativeEvidence": {
      "source": "target-native",
      "eventId": null,
      "workload": {
        "probe": "wrong-host",
        "operation": "query",
        "path": "https://example.org/",
        "observedAt": "2026-09-29T18:28:45Z",
        "outcome": "failure",
        "errno": null,
        "errnoName": null,
        "detail": "\ncurl: (7) Failed to connect to example.org port 443 after 1 ms: Couldn't connect to server\n\n0\n\n\n2026-09-29T18:28:43.641Z OCSF NET:REFUSE [MED] DENIED example.org [reason:policy_dns_ineligible]\n2026-09-29T18:28:43.641Z OCSF CONFIG:OBSERVATION [INFO] Policy DNS staged unapproved name example.org synthetic=198.18.0.3 for TCP policy review\n2026-09-29T18:28:43.642Z OCSF NET:OPEN [MED] DENIED /usr/bin/curl(0) -> example.org:443 [reason:transparent_tcp_policy_denied]\n[1790706523.641] [sandbox] [OCSF ]"
      },
      "logLines": [
        "2026-09-29T18:28:43.641Z OCSF NET:REFUSE [MED] DENIED example.org [reason:policy_dns_ineligible]",
        "2026-09-29T18:28:43.641Z OCSF CONFIG:OBSERVATION [INFO] Policy DNS staged unapproved name example.org synthetic=198.18.0.3 for TCP policy review",
        "2026-09-29T18:28:43.642Z OCSF NET:OPEN [MED] DENIED /usr/bin/curl(0) -> example.org:443 [reason:transparent_tcp_policy_denied]",
        "[1790706523.641] [sandbox] [OCSF ] [ocsf] NET:REFUSE [MED] DENIED example.org [reason:policy_dns_ineligible]",
        "[1790706523.641] [sandbox] [OCSF ] [ocsf] CONFIG:OBSERVATION [INFO] Policy DNS staged unapproved name example.org synthetic=198.18.0.3 for TCP policy review",
        "[1790706523.642] [sandbox] [WARN ] [openshell_supervisor_network::proxy] Denied staged transparent connection destination=198.18.0.3:443 reason=endpoint example.org:443 is not allowed by any policy",
        "[1790706523.642] [sandbox] [OCSF ] [ocsf] NET:OPEN [MED] DENIED /usr/bin/curl(0) -> example.org:443 [reason:transparent_tcp_policy_denied]"
      ]
    }
  },
  {
    "recordType": "fip-runtime-correlation",
    "correlationSource": "fip-side",
    "traceId": "trace-openshell-example",
    "policyId": "pol-openshell-example",
    "exchangeId": null,
    "authorizationId": "az-openshell-example",
    "requirementId": null,
    "bindingId": null,
    "substrateId": null,
    "adapterId": "openshell-v0.1.2",
    "targetPolicyHash": "a39abe060ca48841838cd082a7383c44d95057b2ad6a2a73108aff536b6e1bcf",
    "openshellEventId": null,
    "observedOperation": "query",
    "observedPath": "https://example.com:8443/",
    "runtimeDisposition": "ENFORCED_DENY",
    "authorityClass": "unauthorized",
    "fipGrant": false,
    "observedAt": "2026-09-29T18:28:45Z",
    "targetNativeEvidence": {
      "source": "target-native",